key_droid	key_apple	base_value	lang_value	base_note	lang_note
android_store_whatsnew_analytics	apple_store_whatsnew_analytics	Adds anonymous opt-in analytics to support product improvement.	Adiciona analítica anónima opcional para dar apoio à melhoria do produto.	What's New Item	
	apple_store_whatsnew_darkmode	Adds support for Dark Mode.	Adiciona suporte para o Modo Escuro.	What's New Item	
	apple_store_whatsnew_export	Adds support to export history data.	Adiciona suporte para exportar dados do histórico.	What's New Item	
	apple_store_whatsnew_import	Adds support to import history data.	Adiciona suporte para importar dados do histórico.	What's New Item	
android_store_whatsnew_improvement	apple_store_whatsnew_improvement	General software quality improvements.	Melhorias gerais de qualidade do software.	What's New Item	
