key_droid	key_apple	base_value	lang_value	base_note	lang_note
	apple_store_description.2	In the years of research required to create the more than two-thousand evidence-based videos on his website NutritionFacts.org, Michael Greger, M.D, FACLM, has arrived at a list of what he considers the most important foods to include in a healthy daily diet.	Während der jahrelangen Recherche, die notwendig war, um die mehr als zweitausend evidenzbasierten Videos auf seiner Website NutritionFacts.org zu erstellen, hat Dr. med. Michael Greger, FACLM (Fellow des American College of Lifestyle Medicine), eine Liste der aus seiner Sicht wichtigsten Lebensmittel zusammengestellt, die täglich in eine gesunde Ernährung integriert werden sollten.		
	apple_store_description.4	All the proceeds from his books, DVDs, and speaking engagements are all donated to charity.	Alle Erlöse aus seinen Büchern, DVDs und Vorträgen werden vollständig für wohltätige Zwecke gespendet.		
	apple_store_description.5	NutritionFacts.org is a non-commercial, non-profit, science-based public service provided by Dr. Greger, delivering free daily updates on the latest in nutrition research via bite-sized videos. He has more than two-thousand videos on every aspect of healthy eating, with new videos and articles uploaded every day.	NutritionFacts.org ist ein nicht-kommerzielles, gemeinnütziges, wissenschaftlich fundiertes Angebot von Dr. Greger, das täglich kurze, verständliche Videos mit den neuesten wissenschaftlichen Erkenntnissen zur Ernährung veröffentlicht. Das Angebot umfasst bereits mehr als 2000 Videos zu allen Bereichen einer gesunden Ernährung, und täglich kommen neue Videos und Artikel hinzu.		
store_screen.5	store_screen.5	Dr. Greger’s Daily Dozen - It’s your regular routine that determines your long-term health. Download today!	Dr. Gregers tägliches Dutzend – Ihre tägliche Routine bestimmt Ihre langfristige Gesundheit. Jetzt herunterladen!		
android_store_description.1		All proceeds from his books, DVDs, and speaking engagements are donated to charity.	Alle Erlöse aus seinen Büchern, DVDs und Vorträgen werden vollständig für wohltätige Zwecke gespendet.		
android_store_description.2		NutritionFacts.org is a non-commercial, non-profit, science-based public service provided by Dr. Greger, delivering free daily updates on the latest in nutrition research via bite-sized videos. He has more than two-thousand videos on every aspect of healthy eating, with new videos and articles uploaded every day. Like this app, everything on the website is both free of ads and free of charge.	NutritionFacts.org ist ein nicht-kommerzielles, gemeinnütziges, wissenschaftlich fundiertes Angebot von Dr. Greger, das täglich kurze, verständliche Videos mit den neuesten wissenschaftlichen Erkenntnissen zur Ernährung veröffentlicht. Das Angebot umfasst bereits mehr als 2000 Videos zu allen Bereichen einer gesunden Ernährung, und täglich kommen neue Videos und Artikel hinzu. Wie diese App ist auch die gesamte Website werbefrei und kostenlos.		
